{
  "eventId": "fixture:MESSAGE:spaces/AAA/messages/NO_TEXT:2026-06-29T18:05:00Z",
  "receivedAt": "2026-06-29T18:05:00Z",
  "source": "fixture",
  "kind": "message.created",
  "rawKind": "MESSAGE",
  "actor": {
    "name": "users/789",
    "displayName": "No Text User",
    "email": null,
    "type": "HUMAN",
    "isApp": false,
    "access": {
      "status": "available",
      "reason": null
    }
  },
  "actorState": {
    "status": "available",
    "reason": null
  },
  "space": {
    "name": "spaces/AAA",
    "displayName": "Engineering",
    "type": "ROOM",
    "spaceType": null
  },
  "thread": null,
  "message": {
    "schemaVersion": "message-ast.v1",
    "ref": {
      "name": "spaces/AAA/messages/NO_TEXT"
    },
    "space": {
      "name": "spaces/AAA",
      "displayName": "Engineering",
      "type": "ROOM"
    },
    "thread": null,
    "sender": {
      "displayName": "No Text User",
      "email": null,
      "resourceName": "users/789",
      "type": "HUMAN",
      "accessState": "available",
      "ambiguityState": "unambiguous"
    },
    "createdAt": "2026-06-29T18:05:00Z",
    "updatedAt": null,
    "deletedAt": null,
    "state": {
      "deleted": false,
      "private": false,
      "threadReply": false,
      "directMessage": false
    },
    "privateMessageViewer": null,
    "text": "",
    "formattedText": null,
    "argumentText": null,
    "segments": [],
    "annotations": [],
    "links": [],
    "slashCommand": null,
    "customEmojis": [],
    "attachments": [],
    "attachedGifs": [],
    "cards": [],
    "reactions": [],
    "systemNotes": [
      "System Note: Message spaces/AAA/messages/NO_TEXT from No Text User (HUMAN, users/789) created at 2026-06-29T18:05:00Z."
    ],
    "contextNode": {
      "kind": "message",
      "relationship": "root",
      "ref": {
        "name": "spaces/AAA/messages/NO_TEXT"
      },
      "sender": {
        "displayName": "No Text User",
        "email": null,
        "resourceName": "users/789",
        "type": "HUMAN",
        "accessState": "available",
        "ambiguityState": "unambiguous"
      },
      "createdAt": "2026-06-29T18:05:00Z",
      "updatedAt": null,
      "deletedAt": null,
      "accessState": "available",
      "text": "",
      "systemNotes": [
        "System Note: Message spaces/AAA/messages/NO_TEXT from No Text User (HUMAN, users/789) created at 2026-06-29T18:05:00Z."
      ],
      "children": [],
      "plainTextForModel": "System Note: Message spaces/AAA/messages/NO_TEXT from No Text User (HUMAN, users/789) created at 2026-06-29T18:05:00Z."
    },
    "plainTextForModel": "System Note: Message spaces/AAA/messages/NO_TEXT from No Text User (HUMAN, users/789) created at 2026-06-29T18:05:00Z."
  },
  "action": null,
  "dialog": null,
  "membership": null,
  "reaction": null,
  "locale": null,
  "timeZone": null,
  "authContext": {
    "authType": null,
    "scopes": [],
    "responseMode": "sync"
  },
  "capabilities": {
    "canRespondSynchronously": true,
    "canRespondAsynchronously": true,
    "canReplyInThread": false,
    "canOpenDialog": false,
    "canUpdateCard": false
  },
  "relationship": {
    "isQuote": false,
    "isDirectReply": false,
    "isThreadReply": false,
    "isCardAction": false,
    "isReaction": false,
    "isEdit": false,
    "isDeletion": false,
    "isMembershipEvent": false,
    "isSpaceEvent": false,
    "isUserAction": true,
    "systemNotes": [
      "No Text User sent a message in Engineering."
    ]
  },
  "transport": {
    "kind": "direct",
    "pubsubMessageId": null,
    "pubsubPublishTime": null,
    "pubsubSubscription": null,
    "pubsubDeliveryAttempt": null,
    "workspaceEventId": null,
    "workspaceEventType": null,
    "workspaceEventSource": null,
    "workspaceEventSubject": null
  },
  "idempotencyKey": "fixture:MESSAGE:spaces/AAA/messages/NO_TEXT:2026-06-29T18:05:00Z",
  "raw": {
    "type": "MESSAGE",
    "eventTime": "2026-06-29T18:05:00Z",
    "space": {
      "name": "spaces/AAA",
      "type": "ROOM",
      "displayName": "Engineering"
    },
    "user": {
      "name": "users/789",
      "displayName": "No Text User",
      "type": "HUMAN"
    },
    "message": {
      "name": "spaces/AAA/messages/NO_TEXT",
      "createTime": "2026-06-29T18:05:00Z",
      "sender": {
        "name": "users/789",
        "displayName": "No Text User",
        "type": "HUMAN"
      },
      "space": {
        "name": "spaces/AAA",
        "type": "ROOM",
        "displayName": "Engineering"
      }
    }
  }
}
